{
 "schemaVersion": "1.0.0",
 "meta": {
  "customerName": "Pooja",
  "possessiveName": "Pooja’s",
  "dateText": "8 Oct 2026",
  "dateUpper": "8 OCT 2026",
  "version": 1,
  "currentAge": 27,
  "currentYear": 2026,
  "planEndAge": 80,
  "retireAge": 50,
  "statePensionAge": 66,
  "hasPartner": false,
  "alreadyRetired": false,
  "hasMortgage": false,
  "headerRight": "Pooja’s plan · 8 Oct 2026"
 },
 "footer": {
  "line": "Preliminary guidance, not financial advice. Illustrative, not guaranteed.",
  "coverLine": "Version 1 · Preliminary guidance, not financial advice. An indicative guide: an expert can confirm the details."
 },
 "road": {
  "startAge": 27,
  "endAge": 80,
  "segments": [
   {
    "fromAge": 27,
    "toAge": 50,
    "tone": "good"
   },
   {
    "fromAge": 50,
    "toAge": 52,
    "tone": "gold"
   },
   {
    "fromAge": 52,
    "toAge": 80,
    "tone": "coral"
   }
  ],
  "milestones": [
   {
    "age": 30,
    "label": "Grow my family",
    "sub": "age 30",
    "tone": "good",
    "side": "above",
    "badge": "30"
   },
   {
    "age": 50,
    "label": "You retire",
    "sub": "age 50",
    "tone": "gold",
    "side": "below",
    "badge": "50"
   },
   {
    "age": 52,
    "label": "Savings run out",
    "sub": "age 52",
    "tone": "coral",
    "side": "above",
    "badge": "52"
   },
   {
    "age": 66,
    "label": "State Pension",
    "sub": "age 66",
    "tone": "blue",
    "side": "below",
    "badge": "66"
   }
  ],
  "startLabel": "You, today · age 27",
  "endLabel": "Plan to age 80"
 },
 "cover": {
  "eyebrow": "PREPARED FOR POOJA · 8 OCT 2026",
  "title": "Pooja’s road ahead",
  "lead": "A clear, indicative guide to where you are, where you’re heading, and who can help you get there.",
  "badge": "YOUR PERSONAL PLAN",
  "tiles": [
   {
    "icon": "partly",
    "tone": "gold",
    "big": "1 of 2",
    "small": "goals on track today"
   },
   {
    "icon": "storm",
    "tone": "coral",
    "big": "Age 52",
    "small": "when savings run out"
   },
   {
    "icon": "storm",
    "tone": "blue",
    "big": "Next step",
    "small": "share your plan with an expert"
   }
  ]
 },
 "plan": {
  "big": "1 of 2",
  "bigLabel": "goals on track",
  "bigTone": "coral",
  "eyebrow": "YOUR PLAN ON A PAGE",
  "title": "Family goal on track. Retirement needs a bigger plan",
  "lead": "Grow my family is 100% covered. Retire comfortably is 5% covered. Counting a State Pension, a pension of your own or a later date could change this.",
  "goals": [
   {
    "name": "Grow my family",
    "icon": "family",
    "kind": "family",
    "pct": 100,
    "band": "good",
    "bandText": "On track",
    "meta": "Age 30 · 2029 · €15,000",
    "sentence": "Fully funded. Your income and savings cover it."
   },
   {
    "name": "Retire comfortably",
    "icon": "retire",
    "kind": "retire",
    "pct": 5,
    "band": "alert",
    "bandText": "Needs attention",
    "meta": "From 50 · 2049 · €40,000 a year",
    "sentence": "5% covered without a State Pension, about 29% with the full one. Your savings pay for 2 of 31 retirement years."
   }
  ],
  "band": {
   "kind": "gap",
   "cells": [
    {
     "big": "Age 52",
     "small": "savings run out"
    },
    {
     "big": "29 years",
     "small": "with a gap, to age 80"
    },
    {
     "big": "≈ €1.1m",
     "small": "short in today’s money (€5.3m in future euros)"
    }
   ]
  },
  "close": {
   "title": "What could close the gap",
   "items": [
    {
     "points": "+24 points",
     "tone": "good",
     "title": "Check your State Pension",
     "text": "Not confirmed, so the plan counts €0. A full one could lift cover from 5% to about 29%."
    },
    {
     "points": "+19 points",
     "tone": "gold",
     "title": "Start a pension",
     "text": "€987 a month (about €592 after tax relief) could lift cover to 24%."
    },
    {
     "points": "+11 points",
     "tone": "blue",
     "title": "Choose your retirement age",
     "text": "Retire at 60 and cover reaches 11%. At 65, 16%."
    }
   ]
  },
  "next": {
   "title": "Next: share this plan with an expert",
   "text": "They check the numbers and choose the best way forward.",
   "button": "Meet an expert"
  }
 },
 "money": {
  "big": "€812",
  "bigLabel": "left each month",
  "bigTone": "good",
  "eyebrow": "YOUR MONEY TODAY",
  "title": "A comfortable monthly margin",
  "tiles": [
   {
    "label": "Living costs",
    "value": "€3,000",
    "amount": 3000,
    "tone": "navy"
   },
   {
    "label": "Goals",
    "value": "€813",
    "amount": 813,
    "tone": "teal"
   },
   {
    "label": "Left over",
    "value": "€812",
    "amount": 812,
    "tone": "white"
   }
  ],
  "sentence": "For every €100 you take home, about €18 is left at the end of the month. That gives you room to save more.",
  "takeHome": "Take-home pay is after tax, USC and PRSI (gross pay €79,000).",
  "exampleChip": "example",
  "own": {
   "title": "YOU OWN",
   "rows": [
    {
     "label": "Cash savings",
     "status": "missing"
    },
    {
     "label": "Investments",
     "status": "missing"
    },
    {
     "label": "Pension",
     "status": "missing"
    },
    {
     "label": "Home",
     "value": "Rent"
    }
   ]
  },
  "owe": {
   "title": "YOU OWE",
   "rows": [
    {
     "label": "Mortgage",
     "value": "None"
    },
    {
     "label": "Credit cards",
     "status": "missing"
    },
    {
     "label": "Other loans",
     "status": "missing"
    }
   ]
  },
  "netWorth": {
   "label": "Net worth",
   "status": "not yet known"
  },
  "complete": {
   "eyebrow": "HOW COMPLETE IS YOUR PICTURE?",
   "have": 15,
   "total": 27,
   "sub": "Add these next to sharpen your plan.",
   "photo": "money-plant",
   "items": [
    {
     "title": "Pension value",
     "sub": "The biggest tool for retiring early",
     "priority": "High"
    },
    {
     "title": "Cash savings",
     "sub": "A head start for your pot",
     "priority": "High"
    },
    {
     "title": "State Pension record",
     "sub": "Up to €15,564 a year from 66",
     "priority": "High"
    },
    {
     "title": "Loans and cards",
     "sub": "Debt can cancel out saving",
     "priority": "Medium"
    }
   ]
  }
 },
 "roadmap": {
  "big": "Age 52",
  "bigLabel": "savings run out",
  "bigTone": "coral",
  "eyebrow": "YOUR ROADMAP",
  "title": "Smooth until 50, then savings run out at 52",
  "lead": "Green: income covers life. Gold: savings pay. Coral: a gap to plan for.",
  "decades": [
   {
    "label": "20s",
    "range": "age 27–29",
    "icon": "sun",
    "tone": "good",
    "title": "You are here",
    "chip": "Comfortable",
    "text": "Income comfortably covers life. Savings reach about €30,000 by 29.",
    "goalChips": [],
    "spark": {
     "label": "Savings",
     "values": [
      9877,
      20032,
      30462
     ],
     "gapYears": [
      false,
      false,
      false
     ]
    }
   },
   {
    "label": "30s",
    "range": "age 30–39",
    "icon": "sun",
    "tone": "good",
    "title": "Building your savings",
    "chip": "Comfortable",
    "text": "Income comfortably covers life. Savings reach about €131,000 by 39.",
    "goalChips": [
     {
      "age": 30,
      "text": "Grow my family · 100%",
      "tone": "good"
     }
    ],
    "spark": {
     "label": "Savings",
     "values": [
      23651,
      34023,
      44762,
      55876,
      67374,
      79262,
      91549,
      104243,
      117353,
      130885
     ],
     "gapYears": [
      false,
      false,
      false,
      false,
      false,
      false,
      false,
      false,
      false,
      false
     ]
    }
   },
   {
    "label": "40s",
    "range": "age 40–49",
    "icon": "sun",
    "tone": "good",
    "title": "Building your savings",
    "chip": "Comfortable",
    "text": "Income comfortably covers life. Savings reach about €290,000 by 49.",
    "goalChips": [],
    "spark": {
     "label": "Savings",
     "values": [
      144849,
      159246,
      174063,
      189304,
      204976,
      221082,
      237627,
      254616,
      272054,
      289942
     ],
     "gapYears": [
      false,
      false,
      false,
      false,
      false,
      false,
      false,
      false,
      false,
      false
     ]
    }
   },
   {
    "label": "50s",
    "range": "age 50–59",
    "icon": "storm",
    "tone": "coral",
    "title": "You retire at 50",
    "chip": "A gap to plan for",
    "text": "Short by about €107,214 a year in 8 of these 10 years.",
    "goalChips": [],
    "spark": {
     "label": "Savings",
     "values": [
      196685,
      98075,
      0,
      0,
      0,
      0,
      0,
      0,
      0,
      0
     ],
     "gapYears": [
      false,
      false,
      true,
      true,
      true,
      true,
      true,
      true,
      true,
      true
     ]
    }
   },
   {
    "label": "60s",
    "range": "age 60–69",
    "icon": "storm",
    "tone": "coral",
    "title": "The gap grows with prices",
    "chip": "A gap to plan for",
    "text": "Short by about €168,951 a year, in every year of this decade.",
    "goalChips": [
     {
      "age": 66,
      "text": "State Pension age",
      "tone": "blue"
     }
    ],
    "spark": {
     "label": "Savings",
     "values": [
      0,
      0,
      0,
      0,
      0,
      0,
      0,
      0,
      0,
      0
     ],
     "gapYears": [
      true,
      true,
      true,
      true,
      true,
      true,
      true,
      true,
      true,
      true
     ]
    }
   },
   {
    "label": "70s",
    "range": "age 70–79",
    "icon": "storm",
    "tone": "coral",
    "title": "The gap grows with prices",
    "chip": "A gap to plan for",
    "text": "Short by about €247,695 a year, in every year of this decade.",
    "goalChips": [],
    "spark": {
     "label": "Savings",
     "values": [
      0,
      0,
      0,
      0,
      0,
      0,
      0,
      0,
      0,
      0
     ],
     "gapYears": [
      true,
      true,
      true,
      true,
      true,
      true,
      true,